{
  "schema": "amc.a4-record/v1",
  "projectId": "a4p_747fd6628fe3617032abdaeedd919b28",
  "containsSyntheticExamples": false,
  "tables": {
    "a4_projects": [
      {
        "project_id": "a4p_747fd6628fe3617032abdaeedd919b28",
        "workspace_id": "default",
        "agent_id": "default",
        "name": "Fixture default",
        "stage": "aspire",
        "step": "proposed",
        "hold": 0,
        "hold_reason": null,
        "revision_no": 1,
        "head_seq": 9,
        "head_digest": "95df75eea7e28fb97c1c875ee409b809ea70a09b564257ae671be1e2e9b7a42f",
        "deployed_release_id": null,
        "base_release_id": null,
        "verified_seq": 9,
        "verified_digest": "95df75eea7e28fb97c1c875ee409b809ea70a09b564257ae671be1e2e9b7a42f",
        "created_by_key": "LOCAL_USER:da4583f3-5a35-49ea-8b46-99a77bfacb9a",
        "created_ts": 1791657456733,
        "updated_ts": 1791657456924
      }
    ],
    "a4_transitions": [
      {
        "project_id": "a4p_747fd6628fe3617032abdaeedd919b28",
        "seq": 0,
        "kind": "CREATED",
        "stage": "aspire",
        "revision_no": 0,
        "actor_key": "LOCAL_USER:da4583f3-5a35-49ea-8b46-99a77bfacb9a",
        "actor_username": "alice",
        "body_json": "{\"actorKey\":\"LOCAL_USER:da4583f3-5a35-49ea-8b46-99a77bfacb9a\",\"actorUsername\":\"alice\",\"agentId\":\"default\",\"gatePolicy\":{\"gates\":{\"activate.completion\":{\"actionClass\":\"DEPLOY\",\"requiredReviews\":[],\"ttlDays\":14},\"activate.direction\":{\"actionClass\":\"DEPLOY\",\"requiredReviews\":[],\"ttlDays\":14},\"adapt.completion\":{\"actionClass\":\"SECURITY\",\"requiredReviews\":[{\"kind\":\"role_vote\",\"label\":\"applicability output acknowledged by a workspace auditor (not an expert review; D-08 pending)\",\"role\":\"AUDITOR\"}],\"ttlDays\":14},\"adapt.direction\":{\"actionClass\":\"WRITE_HIGH\",\"requiredReviews\":[],\"ttlDays\":14},\"aspire.completion\":{\"actionClass\":\"WRITE_LOW\",\"requiredReviews\":[],\"ttlDays\":14},\"aspire.direction\":{\"actionClass\":\"WRITE_LOW\",\"requiredReviews\":[],\"ttlDays\":14},\"assemble.completion\":{\"actionClass\":\"WRITE_HIGH\",\"requiredReviews\":[],\"ttlDays\":14},\"assemble.direction\":{\"actionClass\":\"WRITE_LOW\",\"requiredReviews\":[],\"ttlDays\":14},\"policy\":{\"actionClass\":\"WRITE_HIGH\",\"requireDistinctUsers\":true,\"requiredReviews\":[],\"ttlDays\":14}},\"schema\":\"amc.a4-gate-policy/v1\"},\"gatePolicyDigest\":\"a782f22561acb9ae93893b96f35b21b777081bb68aa02f2d6f9b6ce8e6457164\",\"headAfter\":{\"base_release_id\":null,\"deployed_release_id\":null,\"hold\":0,\"hold_reason\":null,\"revision_no\":0,\"stage\":\"aspire\",\"step\":\"asked\"},\"kind\":\"CREATED\",\"name\":\"Fixture default\",\"population\":{\"activeUserCount\":3,\"hostPrincipals\":0},\"prevDigest\":\"GENESIS\",\"projectId\":\"a4p_747fd6628fe3617032abdaeedd919b28\",\"projectPublicKeySha256\":\"09a0fd695fdfaf49e24e98a5e1e43e0de5b9c6d34f923eafb0949cce33fc38ce\",\"readinessSha256\":null,\"revisionNo\":0,\"selfApprovalAllowed\":false,\"selfApprovalFacts\":{\"activeUserCount\":3,\"hostPrincipals\":0,\"hostedRouter\":false,\"ratcheted\":false,\"regulated\":false,\"selfApprovalAllowed\":false},\"seq\":0,\"sideRows\":[{\"key\":{\"project_id\":\"a4p_747fd6628fe3617032abdaeedd919b28\",\"seq\":0},\"sha256\":\"1843ff97a21bad1c43cc9cd2abad3a18d3d692ea16d918301e32153b22cedc39\",\"table\":\"a4_members\"}],\"stage\":\"aspire\",\"ts\":1791657456733,\"workspaceId\":\"default\"}",
        "body_digest": "5a19d4dcc63e5a39718c7a39c0ed79a253693535b8aa2c906788825eeacc60a1",
        "prev_digest": "GENESIS",
        "readiness_sha256": null,
        "envelope_json": null,
        "evidence_event_id": "198ab13e-1700-48ad-8b61-2d4cb343ef7c",
        "ts": 1791657456733
      },
      {
        "project_id": "a4p_747fd6628fe3617032abdaeedd919b28",
        "seq": 1,
        "kind": "MEMBER",
        "stage": "aspire",
        "revision_no": 0,
        "actor_key": "LOCAL_USER:da4583f3-5a35-49ea-8b46-99a77bfacb9a",
        "actor_username": "alice",
        "body_json": "{\"actorKey\":\"LOCAL_USER:da4583f3-5a35-49ea-8b46-99a77bfacb9a\",\"actorUsername\":\"alice\",\"event\":\"added\",\"headAfter\":{\"base_release_id\":null,\"deployed_release_id\":null,\"hold\":0,\"hold_reason\":null,\"revision_no\":0,\"stage\":\"aspire\",\"step\":\"asked\"},\"kind\":\"MEMBER\",\"population\":{\"activeUserCount\":3,\"hostPrincipals\":0},\"prevDigest\":\"5a19d4dcc63e5a39718c7a39c0ed79a253693535b8aa2c906788825eeacc60a1\",\"principalKey\":\"LOCAL_USER:8838c5ec-71f7-4b58-9b0a-da97e128fb70\",\"projectId\":\"a4p_747fd6628fe3617032abdaeedd919b28\",\"readinessSha256\":null,\"revisionNo\":0,\"roles\":[\"builder\",\"approver\"],\"seq\":1,\"sideRows\":[{\"key\":{\"project_id\":\"a4p_747fd6628fe3617032abdaeedd919b28\",\"seq\":1},\"sha256\":\"54504663dc1ce00759fffe592ef0a590a25cd5deee67cf4079cd8b22a31458f5\",\"table\":\"a4_members\"}],\"stage\":\"aspire\",\"ts\":1791657456853}",
        "body_digest": "9c3b8d3c8f6e9df91e570ba27d98a80a9e82e8ce5599ed4a15ff3c7af25c44ce",
        "prev_digest": "5a19d4dcc63e5a39718c7a39c0ed79a253693535b8aa2c906788825eeacc60a1",
        "readiness_sha256": null,
        "envelope_json": null,
        "evidence_event_id": "7650655d-bc3b-499b-ad5f-51b32f2ef625",
        "ts": 1791657456853
      },
      {
        "project_id": "a4p_747fd6628fe3617032abdaeedd919b28",
        "seq": 2,
        "kind": "MEMBER",
        "stage": "aspire",
        "revision_no": 0,
        "actor_key": "LOCAL_USER:da4583f3-5a35-49ea-8b46-99a77bfacb9a",
        "actor_username": "alice",
        "body_json": "{\"actorKey\":\"LOCAL_USER:da4583f3-5a35-49ea-8b46-99a77bfacb9a\",\"actorUsername\":\"alice\",\"event\":\"added\",\"headAfter\":{\"base_release_id\":null,\"deployed_release_id\":null,\"hold\":0,\"hold_reason\":null,\"revision_no\":0,\"stage\":\"aspire\",\"step\":\"asked\"},\"kind\":\"MEMBER\",\"population\":{\"activeUserCount\":3,\"hostPrincipals\":0},\"prevDigest\":\"9c3b8d3c8f6e9df91e570ba27d98a80a9e82e8ce5599ed4a15ff3c7af25c44ce\",\"principalKey\":\"LOCAL_USER:36d7a6a3-c168-44f7-ba52-b7c5f3da5e63\",\"projectId\":\"a4p_747fd6628fe3617032abdaeedd919b28\",\"readinessSha256\":null,\"revisionNo\":0,\"roles\":[\"approver\"],\"seq\":2,\"sideRows\":[{\"key\":{\"project_id\":\"a4p_747fd6628fe3617032abdaeedd919b28\",\"seq\":2},\"sha256\":\"0882ccb18b90871e08046ed4755fefa6735cb9f359d4b0d336d914c5d2453290\",\"table\":\"a4_members\"}],\"stage\":\"aspire\",\"ts\":1791657456867}",
        "body_digest": "005fd34a838ab3067c065a0c4873b60f272370fadd8d4d6c6a7238f5f033668d",
        "prev_digest": "9c3b8d3c8f6e9df91e570ba27d98a80a9e82e8ce5599ed4a15ff3c7af25c44ce",
        "readiness_sha256": null,
        "envelope_json": null,
        "evidence_event_id": "987b03d3-9384-4b33-a10c-184d46e6cafa",
        "ts": 1791657456867
      },
      {
        "project_id": "a4p_747fd6628fe3617032abdaeedd919b28",
        "seq": 3,
        "kind": "REVISION",
        "stage": "aspire",
        "revision_no": 1,
        "actor_key": "LOCAL_USER:da4583f3-5a35-49ea-8b46-99a77bfacb9a",
        "actor_username": "alice",
        "body_json": "{\"actorKey\":\"LOCAL_USER:da4583f3-5a35-49ea-8b46-99a77bfacb9a\",\"actorUsername\":\"alice\",\"headAfter\":{\"base_release_id\":null,\"deployed_release_id\":null,\"hold\":0,\"hold_reason\":null,\"revision_no\":1,\"stage\":\"aspire\",\"step\":\"asked\"},\"kind\":\"REVISION\",\"population\":{\"activeUserCount\":3,\"hostPrincipals\":0},\"prevDigest\":\"005fd34a838ab3067c065a0c4873b60f272370fadd8d4d6c6a7238f5f033668d\",\"projectId\":\"a4p_747fd6628fe3617032abdaeedd919b28\",\"readinessSha256\":null,\"resourceDigestsSha256\":\"2491c2d654027d3d05024d475776caee28bb74fc17c582fdc0d69c3b0e66e6bf\",\"revisionNo\":1,\"seq\":3,\"sideRows\":[{\"key\":{\"project_id\":\"a4p_747fd6628fe3617032abdaeedd919b28\",\"revision_no\":1},\"sha256\":\"70678b6118075e0d92bfc7163a371ed9754523ff0dd366b35891f2de414d834b\",\"table\":\"a4_revisions\"}],\"specDigest\":\"dde6e9df35048fd26fa8ba01ab43658e4dc184438dfbfda580a8a3bcf5405230\",\"stage\":\"aspire\",\"ts\":1791657456876}",
        "body_digest": "ff391ca0a65c40e2f608143d66a4d9988e5ae40a7470705da4171f246febe673",
        "prev_digest": "005fd34a838ab3067c065a0c4873b60f272370fadd8d4d6c6a7238f5f033668d",
        "readiness_sha256": null,
        "envelope_json": null,
        "evidence_event_id": "1a275616-b316-4aec-98e9-eb5349f5a297",
        "ts": 1791657456876
      },
      {
        "project_id": "a4p_747fd6628fe3617032abdaeedd919b28",
        "seq": 4,
        "kind": "EVIDENCE_REF",
        "stage": "aspire",
        "revision_no": 1,
        "actor_key": "LOCAL_USER:da4583f3-5a35-49ea-8b46-99a77bfacb9a",
        "actor_username": "alice",
        "body_json": "{\"actorKey\":\"LOCAL_USER:da4583f3-5a35-49ea-8b46-99a77bfacb9a\",\"actorUsername\":\"alice\",\"claimKind\":\"self_reported\",\"headAfter\":{\"base_release_id\":null,\"deployed_release_id\":null,\"hold\":0,\"hold_reason\":null,\"revision_no\":1,\"stage\":\"aspire\",\"step\":\"asked\"},\"kind\":\"EVIDENCE_REF\",\"lane\":\"implementation\",\"population\":{\"activeUserCount\":3,\"hostPrincipals\":0},\"prevDigest\":\"ff391ca0a65c40e2f608143d66a4d9988e5ae40a7470705da4171f246febe673\",\"projectId\":\"a4p_747fd6628fe3617032abdaeedd919b28\",\"readinessSha256\":null,\"refId\":\"23b95641-3726-41ba-9936-fc008d05c8b8\",\"refKind\":\"ledger_event\",\"revisionNo\":1,\"seq\":4,\"sha256\":\"d037130069b1cb430fbca616e6373dfdeacbe27f2ffd786f2f84a9ef35610dff\",\"sideRows\":[{\"key\":{\"project_id\":\"a4p_747fd6628fe3617032abdaeedd919b28\",\"seq\":4},\"sha256\":\"a24135d4a32e8c3896b6e8f35191c151371154f8796131168ef91928252c1b83\",\"table\":\"a4_evidence_refs\"}],\"stage\":\"aspire\",\"ts\":1791657456881}",
        "body_digest": "0919203e796a40fd4ddd71ca082712c533b5d339fe63415d5974f8de64827710",
        "prev_digest": "ff391ca0a65c40e2f608143d66a4d9988e5ae40a7470705da4171f246febe673",
        "readiness_sha256": null,